{
  "backend": "rust",
  "protocol_version": 1,
  "crate_version": "1.7.9",
  "operations": [
    "probe",
    "zarr.inspect",
    "zarr.read_chunk_f32",
    "zarr.read_region_f32",
    "zarr.write_f32",
    "zarr.read_chunk_f64",
    "zarr.read_region_f64",
    "zarr.write_f64",
    "zarr.rechunk_f64",
    "zarr.rechunk_f64_cancel",
    "zarr.rechunk_f32",
    "zarr.rechunk_f32_codec",
    "zarr.rechunk_f32_cancel",
    "zarr.rechunk_multi",
    "raw.netcdf.inspect",
    "raw.netcdf.convert",
    "resample.nearest",
    "resample.bilinear",
    "resample.conservative",
    "resample.conservative_normed"
  ],
  "capabilities": [
    {"operation": "probe", "supported": true, "reason": null, "limitations": []},
    {"operation": "zarr.inspect", "supported": true, "reason": null, "limitations": ["Zarr v3 directory store"]},
    {"operation": "zarr.read_chunk_f32", "supported": true, "reason": null, "limitations": ["float32 arrays"]},
    {"operation": "zarr.read_region_f32", "supported": true, "reason": null, "limitations": ["float32 arrays"]},
    {"operation": "zarr.write_f32", "supported": true, "reason": null, "limitations": ["float32 arrays"]},
    {"operation": "zarr.read_chunk_f64", "supported": true, "reason": null, "limitations": ["float64 arrays"]},
    {"operation": "zarr.read_region_f64", "supported": true, "reason": null, "limitations": ["float64 arrays"]},
    {"operation": "zarr.write_f64", "supported": true, "reason": null, "limitations": ["float64 arrays"]},
    {"operation": "zarr.rechunk_f64", "supported": true, "reason": null, "limitations": ["single float64 data variable", "source codec preserved"]},
    {"operation": "zarr.rechunk_f64_cancel", "supported": true, "reason": null, "limitations": ["cooperative cancellation", "source codec preserved"]},
    {"operation": "zarr.rechunk_f32", "supported": true, "reason": null, "limitations": ["single float32 data variable"]},
    {"operation": "zarr.rechunk_f32_codec", "supported": true, "reason": null, "limitations": ["single float32 data variable", "explicit lossless codec"]},
    {"operation": "zarr.rechunk_f32_cancel", "supported": true, "reason": null, "limitations": ["cooperative cancellation"]},
    {"operation": "zarr.rechunk_multi", "supported": true, "reason": null, "limitations": ["float32, float64 and standard integer data variables", "fill_value and CF attributes preserved", "source or requested lossless codecs", "atomic staging", "cooperative cancellation"]},
    {"operation": "raw.netcdf.inspect", "supported": true, "reason": null, "limitations": ["NetCDF-4/classic", "time/lat/lon dimensions", "numeric variables"]},
    {"operation": "raw.netcdf.convert", "supported": true, "reason": null, "limitations": ["NetCDF-4/classic", "float32/float64 and unpacked standard integer variables", "Zarr v3 output"]},
    {"operation": "resample.nearest", "supported": true, "reason": null, "limitations": ["float32", "regular latitude/longitude grids", "NaN outside source bounds"]},
    {"operation": "resample.bilinear", "supported": true, "reason": null, "limitations": ["float32", "regular latitude/longitude grids", "NaN outside source bounds"]},
    {"operation": "resample.conservative", "supported": true, "reason": null, "limitations": ["float32", "regular latitude/longitude grids", "spherical cell-area overlap", "NaN outside source bounds"]},
    {"operation": "resample.conservative_normed", "supported": true, "reason": null, "limitations": ["float32", "regular latitude/longitude grids", "spherical cell-area overlap", "NaN outside source bounds"]},
    {"operation": "pipeline.native", "supported": false, "reason": "native pipeline runtime is not implemented in this phase", "limitations": ["use Python fallback"]}
  ]
}
